Provincia,Localidad,Hospital / Unidad Docente,Especialidad,Plazas Ofertadas,Latitud,Longitud
LAS PALMAS,PALMAS DE GRAN CANARIA,UDM SALUD LABORAL DEL SERVICIO CANARIO DE SALUD (ÁREA G. CANARIA). PLAZAS ELEGIBLES PLAZAS,Enfermería Del Trabajo.,2,28.1344745,-15.4350894
LAS PALMAS,PALMAS DE GRAN CANARIA,UDM SALUD LABORAL DEL SERVICIO CANARIO DE SALUD (ÁREA 2 G.CANARIA). PLAZAS ELEGIBLES PLAZAS,Enfermería Del Trabajo.,1,28.1344745,-15.4350894
LAS PALMAS,PALMAS DE GRAN CANARIA,UDM PEDIATRÍA COMPLEJO HOSPITALARIO UNIVERSITARIO INSULAR- MATERNO INFANTIL. PLAZAS ELEGIBLES PLAZAS,Enfermería Pediátrica.,6,28.1344745,-15.4350894
LAS PALMAS,PALMAS DE GRAN CANARIA,UDM PEDIATRIA DEL HOSPITAL DOCTOR JOSÉ MOLINA OROSA. PLAZAS ELEGIBLES PLAZAS,Enfermería Pediátrica.,3,28.1344745,-15.4350894
LAS PALMAS,PUERTO DEL ROSARIO,UDM AFYC FUERTEVENTURA-LAS PALMAS. ZONA IV. PLAZAS ELEGIBLES PLAZAS,Enfermería Familiar Y Comunitaria.,2,28.4993424,-13.8599051
SANTA CRUZ DE TENERIFE,BREÑA ALTA,UDM AFYC LA PALMA. PLAZAS ELEGIBLES PLAZAS,Enfermería Familiar Y Comunitaria.,2,28.6637814,-17.7867588
SANTA CRUZ DE TENERIFE,SAN CRISTÓBAL DE LA LAGUNA,UDM AFYC DE TENERIFE ZONA II (LA LAGUNA). PLAZAS ELEGIBLES PLAZAS,Enfermería Familiar Y Comunitaria.,6,28.4857715,-16.3159422
SANTA CRUZ DE TENERIFE,SAN CRISTÓBAL DE LA LAGUNA,UDM SALUD MENTAL DE TENERIFE. H. UNIVERSITARIO DE CANARIAS. PLAZAS ELEGIBLES PLAZAS,Enfermería De Salud Mental.,5,28.4857715,-16.3159422
SANTA CRUZ DE TENERIFE,SAN CRISTÓBAL DE LA LAGUNA,UDM SALUD LABORAL QUIRÓN PREVENCIÓN TENERIFE. PLAZAS ELEGIBLES PLAZAS,Enfermería Del Trabajo.,1,28.4857715,-16.3159422
SANTA CRUZ DE TENERIFE,SAN CRISTÓBAL DE LA LAGUNA,UD ENFOBG DE TENERIFE. H.UNIVERSITARIO DE CANARIAS. PLAZAS ELEGIBLES PLAZAS,Enfermería Obstetrico-Ginecológica.,5,28.4857715,-16.3159422
SANTA CRUZ DE TENERIFE,SAN CRISTÓBAL DE LA LAGUNA,UDM PEDIATRÍA DE LA DIRECCIÓN SERVICIO CANARIO DE SALUD. C.H. UNIVERSITARIO DE CANARIAS. PLAZAS ELEGIBLES PLAZAS,Enfermería Pediátrica.,2,28.4857715,-16.3159422
SANTA CRUZ DE TENERIFE,SANTA CRUZ DE TENERIFE,UDM SALUD LABORAL DEL SERVICIO CANARIO DE SALUD. (ÁREA TENERIFE). PLAZAS ELEGIBLES PLAZAS,Enfermería Del Trabajo.,2,28.467178,-16.2507843
SANTA CRUZ DE TENERIFE,SANTA CRUZ DE TENERIFE,UDM SALUD LABORAL DEL SERVICIO CANARIO DE SALUD (ÁREA 2 TENERIFE). PLAZAS ELEGIBLES PLAZAS,Enfermería Del Trabajo.,1,28.467178,-16.2507843
SANTA CRUZ DE TENERIFE,SANTA CRUZ DE TENERIFE,UDM SALUD MENTAL TENERIFE. H. UNIVERSITARIO NTRA. SRA. DE LA CANDELARIA. PLAZAS ELEGIBLES PLAZAS,Enfermería De Salud Mental.,5,28.467178,-16.2507843
SANTA CRUZ DE TENERIFE,SANTA CRUZ DE TENERIFE,UDM AFYC TENERIFE ZONA I. PLAZAS ELEGIBLES PLAZAS,Enfermería Familiar Y Comunitaria.,6,28.467178,-16.2507843
SANTA CRUZ DE TENERIFE,SANTA CRUZ DE TENERIFE,UD ENFOBG DE TENERIFE. H. UNIVERSITARIO NTRA. SRA. DE LA CANDELARIA. PLAZAS ELEGIBLES PLAZAS,Enfermería Obstetrico-Ginecológica.,10,28.467178,-16.2507843
SANTA CRUZ DE TENERIFE,SANTA CRUZ DE TENERIFE,UDM PEDIATRÍA DE LA D. DEL SERVICIO CANARIO DE SALUD. H. UNIVERSITARIO NTRA SRA DE LA CANDELARIA. PLAZAS ELEGIBLES PLAZAS,Enfermería Pediátrica.,5,28.467178,-16.2507843
CANTABRIA,LAREDO,UDM GERENCIA ATENCIÓN PRIMARIA DEL SERVICIO CÁNTABRO DE SALUD. ZONA II LAREDO. PLAZAS ELEGIBLES PLAZAS,Enfermería Familiar Y Comunitaria.,2,43.41063,-3.4173
CANTABRIA,SANTANDER,UDM SALUD MENTAL H. UNIVERSITARIO MARQUÉS DE VALDECILLA. PLAZAS ELEGIBLES PLAZAS,Enfermería De Salud Mental.,2,43.4618932,-3.8100255
CANTABRIA,SANTANDER,UDM GERENCIA ATENCIÓN PRIMARIA DEL SERVICIO CÁNTABRO DE SALUD. ZONA I SANTANDER. PLAZAS ELEGIBLES PLAZAS,Enfermería Familiar Y Comunitaria.,5,43.4618932,-3.8100255
CANTABRIA,SANTANDER,UD ENFOBG DE CANTABRIA. PLAZAS ELEGIBLES PLAZAS,Enfermería Obstetrico-Ginecológica.,10,43.4618932,-3.8100255
CANTABRIA,SANTANDER,UDM PEDIATRÍA DEL H. UNIVERSITARIO MARQUÉS DE VALDECILLA. PLAZAS ELEGIBLES PLAZAS,Enfermería Pediátrica.,7,43.4618932,-3.8100255
CANTABRIA,SANTANDER,UDM GERIATRÍA DEL H. UNIVERSITARIO MARQUÉS DE VALDECILLA. PLAZAS ELEGIBLES PLAZAS,Enfermería Geriátrica.,5,43.4618932,-3.8100255
CANTABRIA,TORRELAVEGA,UDM GERENCIA ATENCIÓN PRIMARIA DEL SERVICIO CÁNTABRO DE SALUD. ZONA III TORRELAVEGA. PLAZAS ELEGIBLES PLAZAS,Enfermería Familiar Y Comunitaria.,3,43.3487303,-4.0515082
ÁVILA,ÁVILA,UDM SALUD MENTAL DEL COMPLEJO ASISTENCIAL DE ÁVILA. PLAZAS ELEGIBLES PLAZAS,Enfermería De Salud Mental.,1,40.656478,-4.7002172
ÁVILA,ÁVILA,UDM AFYC ÁVILA. PLAZAS ELEGIBLES PLAZAS,Enfermería Familiar Y Comunitaria.,4,40.656478,-4.7002172
ÁVILA,ÁVILA,UD ENFOBG DE SALAMANCA-ÁVILA. C.A. DE ÁVILA. PLAZAS ELEGIBLES PLAZAS,Enfermería Obstetrico-Ginecológica.,3,40.656478,-4.7002172
BURGOS,ARANDA DE DUERO,UDM AFYC BURGOS. ÁREA ARANDA. PLAZAS ELEGIBLES PLAZAS,Enfermería Familiar Y Comunitaria.,5,41.6715067,-3.6851172
BURGOS,BURGOS,UDM AFYC DE BURGOS. ÁREA BURGOS. PLAZAS ELEGIBLES PLAZAS,Enfermería Familiar Y Comunitaria.,11,42.343926,-3.696977
BURGOS,BURGOS,UDM SALUD LABORAL DE CASTILLA Y LEÓN (COMPLEJO ASISTENCIAL UNIVERSITARIO DE BURGOS). PLAZAS ELEGIBLES PLAZAS,Enfermería Del Trabajo.,1,42.343926,-3.696977
BURGOS,MIRANDA DE EBRO,UDM AFYC BURGOS. ÁREA MIRANDA DE EBRO. PLAZAS ELEGIBLES PLAZAS,Enfermería Familiar Y Comunitaria.,6,42.6855632,-2.9478451
LEÓN,LEÓN,UDM AFYC LEÓN. ZONA I LEÓN. PLAZAS ELEGIBLES PLAZAS,Enfermería Familiar Y Comunitaria.,10,42.5989995,-5.5682413
LEÓN,LEÓN,UDM SALUD MENTAL C. ASISTENCIAL UNIVERSITARIO DE LEÓN. PLAZAS ELEGIBLES PLAZAS,Enfermería De Salud Mental.,5,42.5989995,-5.5682413
LEÓN,LEÓN,UDM DE OBSTETRICIA Y GINECOLOGÍA DEL COMPLEJO ASISTENCIAL UNIVERSITARIO DE LEÓN. PLAZAS ELEGIBLES PLAZAS,Enfermería Obstetrico-Ginecológica.,2,42.5989995,-5.5682413
LEÓN,LEÓN,UDM PEDIATRÍA DEL COMPLEJO ASISTENCIAL UNIVERSITARIO DE LEÓN. PLAZAS ELEGIBLES PLAZAS,Enfermería Pediátrica.,4,42.5989995,-5.5682413
LEÓN,LEÓN,UDM SALUD LABORAL DE CASTILLA Y LEÓN (COMPLEJO ASISTENCIAL DE LEÓN). PLAZAS ELEGIBLES PLAZAS,Enfermería Del Trabajo.,1,42.5989995,-5.5682413
LEÓN,PONFERRADA,UDM SALUD MENTAL H. EL BIERZO. PLAZAS ELEGIBLES PLAZAS,Enfermería De Salud Mental.,1,42.5454124,-6.5938719
LEÓN,PONFERRADA,UDM AFYC DE LEÓN ZONA II-PONFERRADA. PLAZAS ELEGIBLES PLAZAS,Enfermería Familiar Y Comunitaria.,8,42.5454124,-6.5938719
LEÓN,PONFERRADA,UDM PEDIATRÍA DEL H. DEL BIERZO. PLAZAS ELEGIBLES PLAZAS,Enfermería Pediátrica.,1,42.5454124,-6.5938719
PALENCIA,PALENCIA,UDM SALUD MENTAL DEL COMPLEJO ASISTENCIAL UNIVERSITARIO DE PALENCIA. PLAZAS ELEGIBLES PLAZAS,Enfermería De Salud Mental.,5,42.0108856,-4.5328735
PALENCIA,PALENCIA,UDM AFYC PALENCIA. PLAZAS ELEGIBLES PLAZAS,Enfermería Familiar Y Comunitaria.,3,42.0108856,-4.5328735
SALAMANCA,SALAMANCA,UDM SALUD MENTAL COMPLEJO ASISTENCIAL UNIVERSITARIO DE SALAMANCA. PLAZAS ELEGIBLES PLAZAS,Enfermería De Salud Mental.,3,40.9651572,-5.6640182
SALAMANCA,SALAMANCA,UDM AFYC SALAMANCA. PLAZAS ELEGIBLES PLAZAS,Enfermería Familiar Y Comunitaria.,7,40.9651572,-5.6640182
SALAMANCA,SALAMANCA,UD ENFOBG DE SALAMANCA-ÁVILA. C.A. SALAMANCA. PLAZAS ELEGIBLES PLAZAS,Enfermería Obstetrico-Ginecológica.,5,40.9651572,-5.6640182
SALAMANCA,SALAMANCA,UDM PEDIATRÍA DEL COMPLEJO ASISTENCIAL UNIVERSITARIO DE SALAMANCA. PLAZAS ELEGIBLES PLAZAS,Enfermería Pediátrica.,2,40.9651572,-5.6640182
SALAMANCA,SALAMANCA,UDM SALUD LABORAL DE CASTILLA Y LEÓN (COMPLEJO ASISTENCIAL DE SALAMANCA). PLAZAS ELEGIBLES PLAZAS,Enfermería Del Trabajo.,2,40.9651572,-5.6640182
SEGOVIA,SEGOVIA,UDM SALUD MENTAL COMPLEJO ASISTENCIAL DE SEGOVIA. PLAZAS ELEGIBLES PLAZAS,Enfermería De Salud Mental.,1,40.9481192,-4.1172101
SEGOVIA,SEGOVIA,UDM AFYC SEGOVIA. PLAZAS ELEGIBLES PLAZAS,Enfermería Familiar Y Comunitaria.,3,40.9481192,-4.1172101
SEGOVIA,SEGOVIA,UD ENFOBG DE VALLADOLID. COMPLEJO ASISTENCIAL DE SEGOVIA. PLAZAS ELEGIBLES PLAZAS,Enfermería Obstetrico-Ginecológica.,2,40.9481192,-4.1172101
SEGOVIA,SEGOVIA,UDM PEDIATRÍA DEL COMPLEJO ASISTENCIAL DE SEGOVIA. PLAZAS ELEGIBLES PLAZAS,Enfermería Pediátrica.,1,40.9481192,-4.1172101
SEGOVIA,SEGOVIA,UDM GERIATRÍA DEL COMPLEJO ASISTENCIAL DE SEGOVIA. PLAZAS ELEGIBLES PLAZAS,Enfermería Geriátrica.,2,40.9481192,-4.1172101
SORIA,SORIA,UDM SALUD MENTAL COMPLEJO ASISTENCIAL DE SORIA. PLAZAS ELEGIBLES PLAZAS,Enfermería De Salud Mental.,1,41.7633842,-2.4642041
SORIA,SORIA,UDM AFYC DE SORIA. PLAZAS ELEGIBLES PLAZAS,Enfermería Familiar Y Comunitaria.,14,41.7633842,-2.4642041
VALLADOLID,MEDINA DEL CAMPO,UDM AFYC VALLADOLID ESTE. ÁREA MEDINA DEL CAMPO. PLAZAS ELEGIBLES PLAZAS,Enfermería Familiar Y Comunitaria.,1,41.3085496,-4.9150256
VALLADOLID,VALLADOLID,UDM SALUD MENTAL DEL H. CLÍNICO UNIVERSITARIO DE VALLADOLID. PLAZAS ELEGIBLES PLAZAS,Enfermería De Salud Mental.,5,41.6521807,-4.728605
VALLADOLID,VALLADOLID,UDM AFYC VALLADOLID ESTE. ÁREA VALLADOLID. PLAZAS ELEGIBLES PLAZAS,Enfermería Familiar Y Comunitaria.,10,41.6521807,-4.728605
VALLADOLID,VALLADOLID,UDM AFYC VALLADOLID OESTE. PLAZAS ELEGIBLES PLAZAS,Enfermería Familiar Y Comunitaria.,11,41.6521807,-4.728605
VALLADOLID,VALLADOLID,UDM SALUD LABORAL DE CASTILLA Y LEÓN (H.CLINICO UNIVERSITARIO DE VALLADOLID). PLAZAS ELEGIBLES PLAZAS,Enfermería Del Trabajo.,1,41.6521807,-4.728605
VALLADOLID,VALLADOLID,UDM SALUD LABORAL DE CASTILLA Y LEÓN (H.UNIVERSITARIO RÍO HORTEGA). PLAZAS ELEGIBLES PLAZAS,Enfermería Del Trabajo.,1,41.6521807,-4.728605
VALLADOLID,VALLADOLID,UD ENFOBG DE VALLADOLID. H. CLÍNICO UNIVERSITARIO. PLAZAS ELEGIBLES PLAZAS,Enfermería Obstetrico-Ginecológica.,5,41.6521807,-4.728605
VALLADOLID,VALLADOLID,UD ENFOBG DE VALLADOLID. H. DEL RÍO HORTEGA. PLAZAS ELEGIBLES PLAZAS,Enfermería Obstetrico-Ginecológica.,5,41.6521807,-4.728605
VALLADOLID,VALLADOLID,UDM PEDIATRÍA DEL H.UNIVERSITARIO DEL RÍO HORTEGA. PLAZAS ELEGIBLES PLAZAS,Enfermería Pediátrica.,3,41.6521807,-4.728605
VALLADOLID,VALLADOLID,UDM PEDIATRÍA DEL H. CLÍNICO UNIVERSITARIO DE VALLADOLID. PLAZAS ELEGIBLES PLAZAS,Enfermería Pediátrica.,3,41.6521807,-4.728605
ZAMORA,ZAMORA,UDM SALUD MENTAL DEL COMPLEJO ASISTENCIAL DE ZAMORA. PLAZAS ELEGIBLES PLAZAS,Enfermería De Salud Mental.,4,41.5056332,-5.744755
ZAMORA,ZAMORA,UDM DE A FYC DE ZAMORA. PLAZAS ELEGIBLES PLAZAS,Enfermería Familiar Y Comunitaria.,2,41.5056332,-5.744755
ALBACETE,ALBACETE,UDM SALUD MENTAL DEL ÁREA ÚNICA DE GESTIÓN DE ATENCIÓN ESPECIALIZADA DE ALBACETE. PLAZAS ELEGIBLES PLAZAS,Enfermería De Salud Mental.,5,38.9950921,-1.8559154
ALBACETE,ALBACETE,UDM AFYC DE ALBACETE. C.H.UNIVERSITARIO DE ALBACETE. PLAZAS ELEGIBLES PLAZAS,Enfermería Familiar Y Comunitaria.,5,38.9950921,-1.8559154
ALBACETE,ALBACETE,UD ENFOBG DEL SESCAM DE ALBACETE. PLAZAS ELEGIBLES PLAZAS,Enfermería Obstetrico-Ginecológica.,15,38.9950921,-1.8559154
ALBACETE,ALBACETE,UDM PEDIATRÍA DEL ÁREA ÚNICA DE GESTIÓN DE A.E. DE ALBACETE. PLAZAS ELEGIBLES PLAZAS,Enfermería Pediátrica.,5,38.9950921,-1.8559154
ALBACETE,ALBACETE,UDM GERIATRÍA ÁREA ÚNICA DE GESTIÓN DE A.E. DE ALBACETE. PLAZAS ELEGIBLES PLAZAS,Enfermería Geriátrica.,5,38.9950921,-1.8559154
ALBACETE,ALBACETE,UDM SALUD LABORAL DE CASTILLA LA MANCHA-COMPLEJO HOSPITALARIO DE ALBACETE. PLAZAS ELEGIBLES PLAZAS,Enfermería Del Trabajo.,1,38.9950921,-1.8559154
ALBACETE,ALMANSA,UDM AFYC DE ALBACETE. H. GENERAL ALMANSA. PLAZAS ELEGIBLES PLAZAS,Enfermería Familiar Y Comunitaria.,2,38.8682065,-1.0978627
ALBACETE,HELLÍN,UDM AFYC DE ALBACETE. H. HELLÍN. PLAZAS ELEGIBLES PLAZAS,Enfermería Familiar Y Comunitaria.,2,38.5106649,-1.6995137
ALBACETE,HELLÍN,UDM SALUD LABORAL DE CASTILLA LA MANCHA-HOSPITAL DE HELLÍN. PLAZAS ELEGIBLES PLAZAS,Enfermería Del Trabajo.,1,38.5106649,-1.6995137
ALBACETE,VILLARROBLEDO,UDM AFYC DE ALBACETE. H.G. VILLAROBLEDO. PLAZAS ELEGIBLES PLAZAS,Enfermería Familiar Y Comunitaria.,1,39.2681742,-2.6042132
CIUDAD REAL,ALCÁZAR DE SAN JUAN,UDM SALUD MENTAL GERENCIA ATENCIÓN INTEGRADA ALCÁZAR DE S. JUAN. PLAZAS ELEGIBLES PLAZAS,Enfermería De Salud Mental.,1,39.3899806,-3.2101376
CIUDAD REAL,ALCÁZAR DE SAN JUAN,UDM AFYC DE ALCAZAR S. JUAN. PLAZAS ELEGIBLES PLAZAS,Enfermería Familiar Y Comunitaria.,4,39.3899806,-3.2101376
CIUDAD REAL,ALCÁZAR DE SAN JUAN,UD ENFOBG DEL SESCAM LA MANCHA CENTRO. PLAZAS ELEGIBLES PLAZAS,Enfermería Obstetrico-Ginecológica.,6,39.3899806,-3.2101376
CIUDAD REAL,ALCÁZAR DE SAN JUAN,UDM PEDIATRÍA DEL H. GENERAL LA MANCHA CENTRO DE ALCAZAR DE SAN JUAN. PLAZAS ELEGIBLES PLAZAS,Enfermería Pediátrica.,2,39.3899806,-3.2101376
CIUDAD REAL,ALCÁZAR DE SAN JUAN,UDM SALUD LABORAL DE CASTILLA LA MANCHA-HOSPITAL GENERAL LA MANCHA CENTRO. PLAZAS ELEGIBLES PLAZAS,Enfermería Del Trabajo.,1,39.3899806,-3.2101376
CIUDAD REAL,CIUDAD REAL,UDM AFYC CIUDAD REAL. ZONA I CIUDAD REAL. PLAZAS ELEGIBLES PLAZAS,Enfermería Familiar Y Comunitaria.,4,38.9854201,-3.9285138
CIUDAD REAL,CIUDAD REAL,UDM SALUD MENTAL DEL H. GENERAL UNIVERSITARIO DE CIUDAD REAL. PLAZAS ELEGIBLES PLAZAS,Enfermería De Salud Mental.,7,38.9854201,-3.9285138
CIUDAD REAL,CIUDAD REAL,UDM PEDIATRÍA DEL H. GENERAL UNIVERSITARIO DE CIUDAD REAL. PLAZAS ELEGIBLES PLAZAS,Enfermería Pediátrica.,3,38.9854201,-3.9285138
CIUDAD REAL,CIUDAD REAL,UDM GERIATRÍA DEL H. GENERAL UNIVERSITARIO DE CIUDAD REAL. PLAZAS ELEGIBLES PLAZAS,Enfermería Geriátrica.,3,38.9854201,-3.9285138
CIUDAD REAL,CIUDAD REAL,UDM SALUD LABORAL DE CASTILLA LA MANCHA-HOSPITAL GENERAL UNIVERSITARIO DE CIUDAD REAL. PLAZAS ELEGIBLES PLAZAS,Enfermería Del Trabajo.,2,38.9854201,-3.9285138
CIUDAD REAL,MANZANARES,UDM AFYC DE MANZANARES. PLAZAS ELEGIBLES PLAZAS,Enfermería Familiar Y Comunitaria.,2,38.9962242,-3.3722143
CIUDAD REAL,MANZANARES,UDM SALUD LABORAL DE CASTILLA LA MANCHA-HOSPITAL VIRGEN DE ALTAGRACIA. PLAZAS ELEGIBLES PLAZAS,Enfermería Del Trabajo.,1,38.9962242,-3.3722143
CIUDAD REAL,PUERTOLLANO,UDM AFYC CIUDAD REAL. ZONA II PUERTOLLANO. PLAZAS ELEGIBLES PLAZAS,Enfermería Familiar Y Comunitaria.,4,38.6852161,-4.1111749
CIUDAD REAL,TOMELLOSO,UDM AFYC DE TOMELLOSO. PLAZAS ELEGIBLES PLAZAS,Enfermería Familiar Y Comunitaria.,2,39.1585549,-3.0214851
CIUDAD REAL,TOMELLOSO,UDM SALUD LABORAL DE CASTILLA LA MANCHA-HOSPITAL GENERAL DE TOMELLOSO. PLAZAS ELEGIBLES PLAZAS,Enfermería Del Trabajo.,1,39.1585549,-3.0214851
CIUDAD REAL,VALDEPEÑAS,UDM AFYC CIUDAD REAL. ZONA III VALDEPEÑAS. PLAZAS ELEGIBLES PLAZAS,Enfermería Familiar Y Comunitaria.,3,38.7594573,-3.3847392
CUENCA,CUENCA,UDM AFYC DE CUENCA. PLAZAS ELEGIBLES PLAZAS,Enfermería Familiar Y Comunitaria.,6,40.0661031,-2.1313528
CUENCA,CUENCA,UD ENFOBG DEL SESCAM DE CUENCA. PLAZAS ELEGIBLES PLAZAS,Enfermería Obstetrico-Ginecológica.,5,40.0661031,-2.1313528
GUADALAJARA,GUADALAJARA,UDM SALUD MENTAL H. UNIVERSITARIO DE GUADALAJARA. PLAZAS ELEGIBLES PLAZAS,Enfermería De Salud Mental.,3,40.6326979,-3.1646067
GUADALAJARA,GUADALAJARA,UDM AFYC DE GUADALAJARA. PLAZAS ELEGIBLES PLAZAS,Enfermería Familiar Y Comunitaria.,8,40.6326979,-3.1646067
GUADALAJARA,GUADALAJARA,UDM OBSTETRICIA Y GINECOLOGÍA DEL H. UNIVERSITARIO DE GUADALAJARA. PLAZAS ELEGIBLES PLAZAS,Enfermería Obstetrico-Ginecológica.,2,40.6326979,-3.1646067
GUADALAJARA,GUADALAJARA,UDM GERIATRÍA DEL H. GENERAL UNIVERSITARIO DE GUADALAJARA. PLAZAS ELEGIBLES PLAZAS,Enfermería Geriátrica.,3,40.6326979,-3.1646067
GUADALAJARA,GUADALAJARA,UDM SALUD LABORAL DE CASTILLA LA MANCHA-HOSPITAL GENERAL UNIVERSITARIO DE GUADALAJARA. PLAZAS ELEGIBLES PLAZAS,Enfermería Del Trabajo.,1,40.6326979,-3.1646067
TOLEDO,TALAVERA DE LA REINA,UDM SALUD MENTAL H. GENERAL NUESTRA SEÑORA DEL PRADO DE TALAVERA DE LA REINA. PLAZAS ELEGIBLES PLAZAS,Enfermería De Salud Mental.,2,39.9603798,-4.8311717
TOLEDO,TALAVERA DE LA REINA,UDM AFYC DE TALAVERA DE LA REINA. PLAZAS ELEGIBLES PLAZAS,Enfermería Familiar Y Comunitaria.,7,39.9603798,-4.8311717
TOLEDO,TALAVERA DE LA REINA,UDM SALUD LABORAL DE CASTILLA LA MANCHA-H. GENERAL NUESTRA SEÑORA DEL PRADO. PLAZAS ELEGIBLES PLAZAS,Enfermería Del Trabajo.,2,39.9603798,-4.8311717
TOLEDO,TALAVERA DE LA REINA,UDM OBSTETRICIA Y GINECOLOGÍA HOSPITAL GENERAL NUESTRA SEÑORA DEL PRADO. PLAZAS ELEGIBLES PLAZAS,Enfermería Obstetrico-Ginecológica.,2,39.9603798,-4.8311717
TOLEDO,TOLEDO,UDM SALUD MENTAL C.H. UNIVERSITARIO DE TOLEDO. PLAZAS ELEGIBLES PLAZAS,Enfermería De Salud Mental.,3,39.8558913,-4.024265
TOLEDO,TOLEDO,UDM AFYC DE TOLEDO-ÁREA TOLEDO. PLAZAS ELEGIBLES PLAZAS,Enfermería Familiar Y Comunitaria.,10,39.8558913,-4.024265
TOLEDO,TOLEDO,UDM SALUD LABORAL DE CASTILLA LA MANCHA-HOSPITAL UNIVERSITARIO DE TOLEDO. PLAZAS ELEGIBLES PLAZAS,Enfermería Del Trabajo.,1,39.8558913,-4.024265
TOLEDO,TOLEDO,UD ENFOBG DEL SESCAM DE TOLEDO. PLAZAS ELEGIBLES PLAZAS,Enfermería Obstetrico-Ginecológica.,12,39.8558913,-4.024265
TOLEDO,TOLEDO,UDM PEDIATRÍA DEL C.H. UNIVERSITARIO DE TOLEDO. PLAZAS ELEGIBLES PLAZAS,Enfermería Pediátrica.,4,39.8558913,-4.024265
TOLEDO,TOLEDO,UDM GERIATRÍA C.H. UNIVERSITARIO DE TOLEDO. PLAZAS ELEGIBLES PLAZAS,Enfermería Geriátrica.,5,39.8558913,-4.024265
BARCELONA,BADALONA,UDM AFYC BADALONA SERVEIS ASSISTENCIALS. PLAZAS ELEGIBLES PLAZAS,Enfermería Familiar Y Comunitaria.,5,41.4493539,2.248254
BARCELONA,BADALONA,UDM SALUD LABORAL H.UNIVERSITARI GERMANS TRIAS I PUJOL. PLAZAS ELEGIBLES PLAZAS,Enfermería Del Trabajo.,1,41.4493539,2.248254
BARCELONA,BADALONA,UDM OBSTETRICIA Y GINECOLOGÍA H. UNIVERSITARI GERMANS TRIAS I PUJOL. PLAZAS ELEGIBLES PLAZAS,Enfermería Obstetrico-Ginecológica.,4,41.4493539,2.248254
BARCELONA,BADALONA,UDM PEDIATRÍA H. UNIVERSITARI GERMANS TRÍAS Y PUJOL. PLAZAS ELEGIBLES PLAZAS,Enfermería Pediátrica.,4,41.4493539,2.248254
BARCELONA,BADALONA,UDM GERIATRÍA H. UNIVERSITARI GERMANS TRIAS I PUJOL. PLAZAS ELEGIBLES PLAZAS,Enfermería Geriátrica.,2,41.4493539,2.248254
BARCELONA,BADALONA,UDM SALUD MENTAL H. UNIVERSITARI GERMANS TRIAS I PUJOL. PLAZAS ELEGIBLES PLAZAS,Enfermería De Salud Mental.,2,41.4493539,2.248254
BARCELONA,BARCELONA,UDM AFYC BARCELONA CIUTAT ICS. PLAZAS ELEGIBLES PLAZAS,Enfermería Familiar Y Comunitaria.,32,41.3825802,2.177073
BARCELONA,BARCELONA,UDM AFYC ACEBA. PLAZAS ELEGIBLES PLAZAS,Enfermería Familiar Y Comunitaria.,13,41.3825802,2.177073
BARCELONA,BARCELONA,UDM SALUD MENTAL H. DE LA SANTA CREU I SANT PAU. PLAZAS ELEGIBLES PLAZAS,Enfermería De Salud Mental.,4,41.3825802,2.177073
BARCELONA,BARCELONA,UDM AFYC CLÍNIC-MATERNITAT. PLAZAS ELEGIBLES PLAZAS,Enfermería Familiar Y Comunitaria.,8,41.3825802,2.177073
BARCELONA,BARCELONA,UDM SALUD MENTAL DEL H. DEL MAR - PARC DE SALUT MAR. PLAZAS ELEGIBLES PLAZAS,Enfermería De Salud Mental.,8,41.3825802,2.177073
BARCELONA,BARCELONA,UDM AFYC PARC SANITARI PERE VIRGILI. PLAZAS ELEGIBLES PLAZAS,Enfermería Familiar Y Comunitaria.,4,41.3825802,2.177073
BARCELONA,BARCELONA,UDM SALUD LABORAL H. DEL MAR -PARC DE SALUT MAR. PLAZAS ELEGIBLES PLAZAS,Enfermería Del Trabajo.,2,41.3825802,2.177073
BARCELONA,BARCELONA,UDM SALUD LABORAL H. UNIVERSITARI VALL D´HEBRON. PLAZAS ELEGIBLES PLAZAS,Enfermería Del Trabajo.,1,41.3825802,2.177073
BARCELONA,BARCELONA,UDM SALUD LABORAL DEL H. CLÌNIC DE BARCELONA. PLAZAS ELEGIBLES PLAZAS,Enfermería Del Trabajo.,2,41.3825802,2.177073
BARCELONA,BARCELONA,UDM SALUD LABORAL DEL H. SANTA CREU I SANT PAU. PLAZAS ELEGIBLES PLAZAS,Enfermería Del Trabajo.,1,41.3825802,2.177073
BARCELONA,BARCELONA,UDM OBSTETRICIA Y GINECOLOGÍA H. UNIVERSITARI VALL D´HEBRON. PLAZAS ELEGIBLES PLAZAS,Enfermería Obstetrico-Ginecológica.,4,41.3825802,2.177073
BARCELONA,BARCELONA,UDM OBSTETRICIA Y GINECOLOGÍA H. CLÍNIC DE BARCELONA. PLAZAS ELEGIBLES PLAZAS,Enfermería Obstetrico-Ginecológica.,6,41.3825802,2.177073
BARCELONA,BARCELONA,UDM OBSTETRICIA Y GINECOLOGÍA H. DEL MAR - PARC DE SALUT MAR. PLAZAS ELEGIBLES PLAZAS,Enfermería Obstetrico-Ginecológica.,3,41.3825802,2.177073
BARCELONA,BARCELONA,UDM OBSTETRICIA Y GINECOLOGÍA H. DE LA SANTA CREU I SANT PAU. PLAZAS ELEGIBLES PLAZAS,Enfermería Obstetrico-Ginecológica.,3,41.3825802,2.177073
BARCELONA,BARCELONA,UDM PEDIATRÍA H. UNIVERSITARI VALL D´HEBRON. PLAZAS ELEGIBLES PLAZAS,Enfermería Pediátrica.,15,41.3825802,2.177073
BARCELONA,BARCELONA,UDM PEDIATRÍA DEL H. DE LA SANTA CREU I SANT PAU. PLAZAS ELEGIBLES PLAZAS,Enfermería Pediátrica.,4,41.3825802,2.177073
BARCELONA,BARCELONA,UDM PEDIATRÍA CORPORACIÓ SANITÀRIA PARC TAULÍ PLAZAS ELEGIBLES PLAZAS,Enfermería Pediátrica.,3,41.3825802,2.177073
BARCELONA,BARCELONA,UDM PEDIATRÍA HOSPITAL HM NENS DE BARCELONA. PLAZAS ELEGIBLES PLAZAS,Enfermería Pediátrica.,1,41.3825802,2.177073
BARCELONA,BARCELONA,UDM PEDIATRÍA DEL HOSPITAL UNIVERSITARI DEXEUS. PLAZAS ELEGIBLES PLAZAS,Enfermería Pediátrica.,1,41.3825802,2.177073
BARCELONA,BARCELONA,UDM GERIATRÍA H. CLÍNIC DE BARCELONA. PLAZAS ELEGIBLES PLAZAS,Enfermería Geriátrica.,2,41.3825802,2.177073
BARCELONA,BARCELONA,UDM GERIATRÍA H. DEL MAR -PARC DE SALUT MAR. PLAZAS ELEGIBLES PLAZAS,Enfermería Geriátrica.,2,41.3825802,2.177073
BARCELONA,BARCELONA,UDM SALUD MENTAL H. CLÍNIC DE BARCELONA. PLAZAS ELEGIBLES PLAZAS,Enfermería De Salud Mental.,5,41.3825802,2.177073
BARCELONA,BARCELONA,UDM SALUD MENTAL H. UNIVERSITARIO VALL D´ HEBRON. PLAZAS ELEGIBLES PLAZAS,Enfermería De Salud Mental.,2,41.3825802,2.177073
BARCELONA,CALELLA,UDM GERIATRÍA DE LA CORPORACIÓ DE SALUT DEL MARESME I LA SELVA. PLAZAS ELEGIBLES PLAZAS,Enfermería Geriátrica.,3,41.6132925,2.6576102
BARCELONA,CORNELLÀ DE LLOBREGAT,UDM AFYC COSTA PONENT (METROPOLITANA SUD) ICS. PLAZAS ELEGIBLES PLAZAS,Enfermería Familiar Y Comunitaria.,32,41.355724,2.0706225
BARCELONA,ESPLUGUES DE LLOBREGAT,UDM OBSTETRICIA Y GINECOLOGÍA H. SANT JOAN DE DÉU. PLAZAS ELEGIBLES PLAZAS,Enfermería Obstetrico-Ginecológica.,4,41.3776796,2.0899722
BARCELONA,ESPLUGUES DE LLOBREGAT,UDM PEDIATRÍA H. SANT JOAN DE DÉU. PLAZAS ELEGIBLES PLAZAS,Enfermería Pediátrica.,16,41.3776796,2.0899722
BARCELONA,GRANOLLERS,UDM SALUD LABORAL DE LA FUNDACIÓ PRIVADA H. ASIL DE GRANOLLERS. PLAZAS ELEGIBLES PLAZAS,Enfermería Del Trabajo.,1,41.6079555,2.2876008
BARCELONA,GRANOLLERS,UDM OBSTETRICIA Y GINECOLOGÍA FUNDACIÓ PRIVADA H. ASIL DE GRANOLLERS. PLAZAS ELEGIBLES PLAZAS,Enfermería Obstetrico-Ginecológica.,4,41.6079555,2.2876008
BARCELONA,GRANOLLERS,UDM GERIATRÍA FUNDACIÓ PRIVADA H. ASIL DE GRANOLLERS. PLAZAS ELEGIBLES PLAZAS,Enfermería Geriátrica.,3,41.6079555,2.2876008
BARCELONA,L´HOSPITALET DE LLOBREGAT,UDM SALUD LABORAL HOSPITAL UNIVERSITARI DE BELLVITGE. PLAZAS ELEGIBLES PLAZAS,Enfermería Del Trabajo.,1,41.3598601,2.0997927
BARCELONA,L´HOSPITALET DE LLOBREGAT,UDM SALUD LABORAL DEL CONSORCI SANITARI INTEGRAL. PLAZAS ELEGIBLES PLAZAS,Enfermería Del Trabajo.,1,41.3598601,2.0997927
BARCELONA,L´HOSPITALET DE LLOBREGAT,UDM OBSTETRICIA Y GINECOLOGÍA CONSORCI SANITARI INTEGRAL. PLAZAS ELEGIBLES PLAZAS,Enfermería Obstetrico-Ginecológica.,3,41.3598601,2.0997927
BARCELONA,L´HOSPITALET DE LLOBREGAT,UDM GERIATRÍA CONSORCI SANITARI INTEGRAL. PLAZAS ELEGIBLES PLAZAS,Enfermería Geriátrica.,3,41.3598601,2.0997927
BARCELONA,L´HOSPITALET DE LLOBREGAT,UDM SALUD MENTAL H. UNIVERSITARI DE BELLVITGE. PLAZAS ELEGIBLES PLAZAS,Enfermería De Salud Mental.,2,41.3598601,2.0997927
BARCELONA,IGUALADA,UDM OBSTETRICIA Y GINECOLOGÍA CONSORCI SANITARI DE L´ANOIA. H. D ´IGUALADA. PLAZAS ELEGIBLES PLAZAS,Enfermería Obstetrico-Ginecológica.,2,41.5790182,1.617346
BARCELONA,IGUALADA,UDM GERIATRÍA CONSORCI SANITARI DE L´ANOIA. H. D´IGUALADA. PLAZAS ELEGIBLES PLAZAS,Enfermería Geriátrica.,3,41.5790182,1.617346
BARCELONA,MANRESA,UDM AFYC CATALUNYA CENTRAL ICS. PLAZAS ELEGIBLES PLAZAS,Enfermería Familiar Y Comunitaria.,19,41.7288939,1.8286765
BARCELONA,MANRESA,"UDM OBSTETRICIA Y GINECOLOGÍA H. UNIVERSITARI SANT JOAN DE DÉU DE MANRESA, ALTHAIA. PLAZAS ELEGIBLES PLAZAS",Enfermería Obstetrico-Ginecológica.,3,41.7288939,1.8286765
BARCELONA,MANRESA,"UDM SALUD MENTAL. H. UNIVERSITARI SANT JOAN DE DÉU DE MANRESA, ALTHAIA. PLAZAS ELEGIBLES PLAZAS",Enfermería De Salud Mental.,2,41.7288939,1.8286765
BARCELONA,MARTORELL,UDM SALUT MENTAL FUNDACIÓ HOSPITALÀRIES MARTORELL. PLAZAS ELEGIBLES PLAZAS,Enfermería De Salud Mental.,2,41.4769177,1.9283971
BARCELONA,MATARÓ,UDM SALUD MENTAL CONSORCI SANITARI DEL MARESME. PLAZAS ELEGIBLES PLAZAS,Enfermería De Salud Mental.,3,41.5398348,2.4448926
BARCELONA,MATARÓ,UDM AFYC CONSORCI SANITARI DEL MARESME. PLAZAS ELEGIBLES PLAZAS,Enfermería Familiar Y Comunitaria.,8,41.5398348,2.4448926
BARCELONA,MATARÓ,UDM OBSTETRICIA Y GINECOLOGÍA CONSORCI SANITARI DEL MARESME. PLAZAS ELEGIBLES PLAZAS,Enfermería Obstetrico-Ginecológica.,3,41.5398348,2.4448926
BARCELONA,MATARÓ,UDM GERIATRÍA DEL CONSORCI SANITARI DEL MARESME. PLAZAS ELEGIBLES PLAZAS,Enfermería Geriátrica.,1,41.5398348,2.4448926
BARCELONA,MOLLET DEL VALLÈS,UDM GERIATRÍA H. DE MOLLET. PLAZAS ELEGIBLES PLAZAS,Enfermería Geriátrica.,1,41.5393484,2.2130934
BARCELONA,SABADELL,UDM SALUD MENTAL CORPORACIÓ SANITÀRIA PARC TAULÍ PLAZAS ELEGIBLES PLAZAS,Enfermería De Salud Mental.,3,41.5421013,2.1138977
BARCELONA,SABADELL,UDM AFYC METROPOLITANA NORD ICS. PLAZAS ELEGIBLES PLAZAS,Enfermería Familiar Y Comunitaria.,13,41.5421013,2.1138977
BARCELONA,SABADELL,UDM SALUD LABORAL CORPORACIÓ SANITÀRIA PARC TAULÌ PLAZAS ELEGIBLES PLAZAS,Enfermería Del Trabajo.,1,41.5421013,2.1138977
BARCELONA,SABADELL,UDM OBSTETRICIA Y GINECOLOGÍA CORPORACIÓ SANITÀRIA PARC TAULÍ PLAZAS ELEGIBLES PLAZAS,Enfermería Obstetrico-Ginecológica.,4,41.5421013,2.1138977
BARCELONA,SABADELL,UDM GERIATRÍA CORPORACIÓ SANITÀRIA PARC TAULÍ PLAZAS ELEGIBLES PLAZAS,Enfermería Geriátrica.,2,41.5421013,2.1138977
BARCELONA,SANT BOI DE LLOBREGAT,UDM OBSTETRICIA Y GINECOLOGÍA PARC SANITARI SANT JOAN DE DÉU. PLAZAS ELEGIBLES PLAZAS,Enfermería Obstetrico-Ginecológica.,1,41.3459033,2.0413673
BARCELONA,SANT BOI DE LLOBREGAT,UDM GERIATRÍA PARC SANITARI SANT JOAN DE DÉU. PLAZAS ELEGIBLES PLAZAS,Enfermería Geriátrica.,1,41.3459033,2.0413673
BARCELONA,SANT BOI DE LLOBREGAT,UDM SALUD MENTAL FUNDACIÓ HOSPITALÀRIES SANT BOI. PLAZAS ELEGIBLES PLAZAS,Enfermería De Salud Mental.,4,41.3459033,2.0413673
